{
  "$schema": "./workflow.schema.json",
  "schema_version": 1,
  "id": "new-feature",
  "title": "New capability delivery",
  "intent": "Discover, design, implement, review, document, and verify a new capability without eroding existing architecture or security boundaries.",
  "instruction_priority": "The user request and higher-level instructions take precedence. This graph does not grant broader mutation, delegation, release, deployment, or external-action authority.",
  "entrypoint": "discovery",
  "terminal_nodes": ["final_gate"],
  "documentation_node": "docs_sync",
  "final_gate": "final_gate",
  "required_reviewers": ["architecture_review", "correctness_review", "risk_review"],
  "review_policy": {
    "independence": "Reviewers are read-only, must not author the feature they review, and must cite inspected evidence.",
    "blocking_severities": ["P0", "P1", "P2"],
    "finding_schema": ["id", "severity", "dimension", "location", "evidence", "impact", "required_action"]
  },
  "nodes": {
    "discovery": {
      "kind": "intake",
      "may_edit": false,
      "system_prompt": "You are the feature discovery gate. Convert the user's desired outcome into actors, use cases, acceptance criteria, constraints, non-goals, and an explicit authorization boundary.",
      "guide": ["Record initial worktree state and preserve unrelated changes.", "Distinguish the minimum valuable feature from future extensions.", "Identify public API, CLI, protocol, schema, security, compatibility, and operational expectations."],
      "skills": ["agyent-engineering-workflow"],
      "tools": ["shell:git status --short", "shell:rg", "shell:go list"],
      "inputs": ["user_request"],
      "outputs": ["feature_contract", "acceptance_criteria", "non_goals"],
      "gate": {"requires": ["feature_contract", "acceptance_criteria", "non_goals"], "acceptance": ["The minimum feature and observable success are explicit.", "No unrequested deployment or external mutation is implied."]},
      "transitions": {"accepted": "architecture_design"}
    },
    "architecture_design": {
      "kind": "design",
      "may_edit": false,
      "system_prompt": "You are the feature architect. Fit the capability into existing domain, ports, policy, adapters, composition, storage, and lifecycle boundaries before defining implementation slices.",
      "guide": ["Trace comparable implemented capabilities and extension seams.", "Draw input to domain to policy to port to adapter to event or output.", "Assess authorization, tenant identity, migrations, concurrency, cancellation, prompt order, plugins, and compatibility."],
      "skills": ["agyent-engineering-workflow"],
      "tools": ["shell:rg", "shell:go list -deps", "shell:git log", "shell:python3 scripts/check_architecture.py"],
      "inputs": ["feature_contract", "acceptance_criteria", "non_goals"],
      "outputs": ["architecture_contract", "impact_map", "risk_register"],
      "gate": {"requires": ["architecture_contract", "impact_map", "risk_register"], "acceptance": ["Ownership and dependency direction are explicit.", "Every material security, data, compatibility, and lifecycle risk has a treatment."]},
      "transitions": {"ready": "adr_decision"}
    },
    "adr_decision": {
      "kind": "documentation",
      "may_edit": true,
      "system_prompt": "You are the architecture-decision gate. Decide whether the feature changes a hard-to-reverse contract or boundary and create a focused ADR when required before implementation.",
      "guide": ["Apply the threshold in docs/adr/README.md.", "Record alternatives, tradeoffs, consequences, and migration when an ADR is required.", "Otherwise record an explicit no-ADR rationale."],
      "skills": ["agyent-engineering-workflow"],
      "tools": ["apply_patch", "shell:rg", "shell:make docs-check"],
      "inputs": ["architecture_contract", "impact_map", "risk_register"],
      "outputs": ["adr_decision", "adr_diff_or_rationale", "decision_constraints"],
      "gate": {"requires": ["adr_decision", "adr_diff_or_rationale", "decision_constraints"], "acceptance": ["The ADR threshold is evaluated against every cross-cutting decision.", "Any required ADR passes documentation validation."]},
      "transitions": {"decided": "delivery_plan"}
    },
    "delivery_plan": {
      "kind": "design",
      "may_edit": false,
      "system_prompt": "You are the feature delivery planner. Define contract-first implementation slices, behavioral and negative tests, migrations, rollback, observability, and documentation changes that prove acceptance criteria.",
      "guide": ["Keep each slice buildable and reviewable where practical.", "Map each acceptance criterion and risk to a test or inspection.", "Include fresh and upgrade paths for persistence plus fail-closed paths for security."],
      "skills": ["agyent-engineering-workflow"],
      "tools": ["shell:rg", "shell:go test -list", "shell:git diff"],
      "inputs": ["acceptance_criteria", "architecture_contract", "risk_register", "decision_constraints"],
      "outputs": ["implementation_plan", "verification_plan", "docs_plan"],
      "gate": {"requires": ["implementation_plan", "verification_plan", "docs_plan"], "acceptance": ["Every acceptance criterion and material risk is traceable.", "The plan respects non-goals and decision constraints."]},
      "transitions": {"accepted": "implement"}
    },
    "implement": {
      "kind": "implementation",
      "may_edit": true,
      "system_prompt": "You are the feature implementer. Build contract-first, tested slices inside the accepted architecture while preserving existing behavior, user changes, and all authorization and isolation invariants.",
      "guide": ["Add domain and core-owned ports only when the core owns the contract.", "Implement technology details in adapters and object wiring in cmd/agyent.", "Add migrations immutably and keep prompt inputs deterministic where applicable."],
      "skills": ["agyent-engineering-workflow"],
      "tools": ["apply_patch", "shell:gofmt", "shell:go test -run", "shell:git diff"],
      "inputs": ["implementation_plan", "architecture_contract", "verification_plan"],
      "outputs": ["implementation_diff", "behavioral_tests", "scope_accounting"],
      "gate": {"requires": ["implementation_diff", "behavioral_tests", "scope_accounting"], "acceptance": ["Implemented behavior maps to accepted feature criteria.", "No non-goal or unrelated user work was changed."]},
      "transitions": {"implemented": "focused_verification"}
    },
    "focused_verification": {
      "kind": "verification",
      "may_edit": false,
      "system_prompt": "You are the feature verifier. Prove acceptance criteria, backward compatibility, failure and denied paths, migration behavior, cancellation, and operational cleanup with reproducible evidence.",
      "guide": ["Run focused unit and integration tests for the new path.", "Run race, security, migration, cross-platform, plugin, or prompt-order checks from the risk register.", "Record commands, exit codes, skips, and residual risk."],
      "skills": ["agyent-engineering-workflow"],
      "tools": ["shell:go test", "shell:go test -race", "shell:go vet", "shell:make architecture-check"],
      "inputs": ["implementation_diff", "behavioral_tests", "verification_plan", "risk_register"],
      "outputs": ["acceptance_evidence", "risk_verification_evidence", "residual_risk"],
      "gate": {"requires": ["acceptance_evidence", "risk_verification_evidence", "residual_risk"], "acceptance": ["Every acceptance criterion has evidence.", "Every material risk check passes or blocks the workflow."]},
      "transitions": {"passed": "docs_sync", "failed": "implement"}
    },
    "docs_sync": {
      "kind": "documentation",
      "may_edit": true,
      "system_prompt": "You are the feature documentation synchronizer. Update canonical architecture, component references, user guidance, AGENTS rules, skills, schemas, help, changelog, and ADR status to exactly match shipped behavior.",
      "guide": ["Use the docs authority map and update only relevant current documents.", "Ensure skills name real tools and arguments and Proposed text does not claim implementation.", "Validate links, code references, manifests, graphs, and skills."],
      "skills": ["agyent-engineering-workflow"],
      "tools": ["apply_patch", "shell:rg", "shell:make docs-check", "skill:quick_validate"],
      "inputs": ["implementation_diff", "docs_plan", "adr_decision", "residual_risk"],
      "outputs": ["docs_impact_matrix", "docs_diff_or_rationale", "docs_validation"],
      "gate": {"requires": ["docs_impact_matrix", "docs_diff_or_rationale", "docs_validation"], "acceptance": ["Every public, architectural, operational, and skill contract is dispositioned.", "Documentation, workflow, and skill validation pass."]},
      "transitions": {"ready": ["architecture_review", "correctness_review", "risk_review"]}
    },
    "architecture_review": {
      "kind": "review",
      "may_edit": false,
      "system_prompt": "You are an independent feature architecture reviewer. Do not edit. Challenge domain and port ownership, adapter boundaries, wiring, schema evolution, prompt order, extension seams, and documentation truth.",
      "guide": ["Inspect the full diff, contracts, implementations, callers, migrations, and docs.", "Compare the result with the ADR decision and repository invariants.", "Return structured findings with exact evidence."],
      "skills": ["agyent-engineering-workflow"],
      "tools": ["collaboration:spawn_agent when authorized", "shell:git diff", "shell:go list -deps", "shell:make architecture-check"],
      "inputs": ["architecture_contract", "implementation_diff", "adr_diff_or_rationale", "docs_diff_or_rationale"],
      "outputs": ["architecture_review_report"],